{
  "version": "2.0",
  "meta": {
    "stage": "regime_optimization",
    "created_at": "2026-01-24T14:30:00Z",
    "optimization_id": "regime_opt_BTCUSDT_5m_20260124",
    "total_combinations": 240,
    "completed": 240,
    "duration_seconds": 32.5,
    "method": "grid_search",
    "mode": "manual",
    "source": {
      "symbol": "BTCUSDT",
      "timeframe": "5m",
      "bars": 401,
      "data_range": {
        "start": "2026-01-22T12:10:00Z",
        "end": "2026-01-23T21:30:00Z"
      }
    },
    "statistics": {
      "score_min": 28.3,
      "score_max": 78.5,
      "score_avg": 54.2,
      "score_median": 55.8
    }
  },
  "param_ranges": {
    "adx_period": { "min": 10, "max": 20, "step": 2 },
    "adx_threshold": { "min": 17, "max": 40, "step": 3 },
    "rsi_period": { "min": 9, "max": 21, "step": 3 }
  },
  "results": [
    {
      "rank": 1,
      "score": 78.5,
      "selected": true,
      "exported": true,
      "params": {
        "adx_period": 10,
        "adx_threshold": 17,
        "rsi_period": 9
      },
      "metrics": {
        "regime_count": 15,
        "avg_duration_bars": 26.7,
        "switch_count": 14,
        "stability_score": 0.73,
        "coverage": 100.0,
        "f1_bull": 0.82,
        "f1_bear": 0.79,
        "f1_sideways": 0.71,
        "bull_bars": 180,
        "bear_bars": 101,
        "sideways_bars": 120
      },
      "timestamp": "2026-01-24T14:28:15Z"
    },
    {
      "rank": 2,
      "score": 76.2,
      "selected": false,
      "exported": false,
      "params": {
        "adx_period": 10,
        "adx_threshold": 20,
        "rsi_period": 9
      },
      "metrics": {
        "regime_count": 12,
        "avg_duration_bars": 33.4,
        "switch_count": 11,
        "stability_score": 0.77,
        "coverage": 100.0,
        "f1_bull": 0.80,
        "f1_bear": 0.77,
        "f1_sideways": 0.73,
        "bull_bars": 165,
        "bear_bars": 95,
        "sideways_bars": 141
      },
      "timestamp": "2026-01-24T14:28:18Z"
    },
    {
      "rank": 3,
      "score": 74.8,
      "selected": false,
      "exported": false,
      "params": {
        "adx_period": 12,
        "adx_threshold": 17,
        "rsi_period": 12
      },
      "metrics": {
        "regime_count": 18,
        "avg_duration_bars": 22.3,
        "switch_count": 17,
        "stability_score": 0.68,
        "coverage": 100.0,
        "f1_bull": 0.78,
        "f1_bear": 0.76,
        "f1_sideways": 0.69,
        "bull_bars": 175,
        "bear_bars": 108,
        "sideways_bars": 118
      },
      "timestamp": "2026-01-24T14:28:22Z"
    },
    {
      "rank": 4,
      "score": 71.5,
      "selected": false,
      "exported": false,
      "params": {
        "adx_period": 14,
        "adx_threshold": 20,
        "rsi_period": 9
      },
      "metrics": {
        "regime_count": 10,
        "avg_duration_bars": 40.1,
        "switch_count": 9,
        "stability_score": 0.81,
        "coverage": 100.0,
        "f1_bull": 0.74,
        "f1_bear": 0.73,
        "f1_sideways": 0.67,
        "bull_bars": 152,
        "bear_bars": 89,
        "sideways_bars": 160
      },
      "timestamp": "2026-01-24T14:28:25Z"
    },
    {
      "rank": 5,
      "score": 68.9,
      "selected": false,
      "exported": false,
      "params": {
        "adx_period": 10,
        "adx_threshold": 23,
        "rsi_period": 12
      },
      "metrics": {
        "regime_count": 9,
        "avg_duration_bars": 44.6,
        "switch_count": 8,
        "stability_score": 0.84,
        "coverage": 100.0,
        "f1_bull": 0.71,
        "f1_bear": 0.69,
        "f1_sideways": 0.65,
        "bull_bars": 148,
        "bear_bars": 82,
        "sideways_bars": 171
      },
      "timestamp": "2026-01-24T14:28:28Z"
    }
  ]
}
